{
  "description": "A unit covering a critical source is protected and never a review candidate, even with full evidence.",
  "command": "report",
  "rules": [
    {
      "id": "A10",
      "polarity": "negative"
    },
    {
      "id": "T8",
      "polarity": "positive"
    }
  ],
  "expectExit": 0
}
