{
  "description": "Kills count detected mutants (killed or timeout); unique kills need a non-empty killedBy of one unit; errors are excluded from the score.",
  "command": "report",
  "rules": [
    {
      "id": "S3",
      "polarity": "positive"
    },
    {
      "id": "S3",
      "polarity": "negative"
    },
    {
      "id": "A7",
      "polarity": "positive"
    },
    {
      "id": "R2",
      "polarity": "positive"
    }
  ],
  "expectExit": 0
}
