{
  "description": "Critical tests add value even without unique lines.",
  "command": "check",
  "rules": [
    {
      "id": "C1",
      "polarity": "positive"
    },
    {
      "id": "C2",
      "polarity": "negative"
    }
  ],
  "args": {
    "tests": [
      "crit",
      "new1"
    ]
  },
  "expectExit": 0
}
